영화제목,아이디,평점,댓글
랑종,sain****,1,"난 지난 주말 장흥 자동차 극장에서 인터넷에 넘쳐나는 광고에 낚인 물고기들과 같이 인생 최악의 영화에 시간과 돈을 잃었다. 영화가 끝나기도 한참전에 모두가 한마음 한뜻인듯 제일 뒷줄 차들이 빠져나가기 시작하자 움직일수 있는 차들순으로  줄줄이 빠져나가기 시작했다. 아무리 돈이면 무엇이든 하는 시대라지만  기획,제작,수입,배포,현시간에도 올라오는 리뷰포함 광고  이 영화 이 모든 것에 관련된 분들 당신들의 돈벌이를 위해서 누군간 허탈함과 배신감까지 느꼈었습니다. 계속 그렇게 돈 되는 일이면 뭐든지 하시면서 쭈욱 행복하시길..."
블랙 위도우,goof****,10,재밌었어요. 보는 내내 착취 여성들이 생각났는데 힘들었습니다.
블랙 위도우,jul1****,10,"보는내내 너무 멋있는 액션에 소름이 쫙쫙 감탄하고, 나타샤의 과거의 아픔을 고스란히 보여주는 현재의 모습... 그리고 엔드게임 이후의 장면까지 눈물이 안날 수가 없었다.언니 존멋... 마블에서 내 최애 캐릭터 이제 진짜 보내줘야하나ㅠㅠ"
극장판 귀멸의 칼날: 무한열차편,ssju****,10,그냥 ... 눈물 콧물 범벅 ...
러브레터,hgh0****,9,러브레터를 통해 전개되는 영화의 과정에서 사랑에 대해 깊게 들어가지는 않지만 은은하게 사랑의 메세지를 보내고 있음을 느꼈다. 병원에서 이츠키와 히로코의 오갱끼데쓰가를 번갈아가며 외치는 장면은 죽은 이츠키에게만이 아니라 서로에게 괜찮냐고 물어보는 느낌을 주기위해서까지가 아닐까 생각이들었다.
블랙 위도우,psvo****,10,"재미있는 액션영화! 닥터 스트레인지 본 후 마블 별로 안 좋아하는 사람이 있는데 같이 봐도 좋았을 것 같아요. 스칼릿 조핸슨을 비롯한 플로렌스 퓨, 레이첼 와이즈, 데이빗 하버 모두 연기 잘하고 액션도 좋아요. 나타샤는 정말 멋져요!"
스페이스 잼: 새로운 시대,thpa****,1,블랙위도우나 볼껄;;
마당을 나온 암탉,2004****,10,감동적이고 마음이 따뜻해지는 영화. 어머니의 사랑에 대해 한번 더 생각할 수 있다. 잎삭의 목소리가 정말 마음을 울렸다. 보고나면 여운이 남는 꼭 봐야하는 영화.
발신제한,ioii****,7,오랜만에 극장에서 보니 걍 잼있음 ㅎ주연 조우진 배우와 딸 역할 배우 연기 넘 잘하고 빈약한 스토리를 충분히 메꿔줌
야쿠자와 가족,alon****,10,"비단 야쿠자만의 일은 아닐 거라 본다. 의리나 가족 이런 것보다 앞서고 무서운 일이 돈이라는 것이고, 돈과 흐르는 세월 앞에 장사 없다는 생각이 든다. 나도 주인공의 나이가 된 지금 다소 초라하다."
랑종,dawo****,8,하도 욕하는 후기가 많아서 일부러 예고편도 안보고 기대안하고 심지어 더 무섭게 보려고 사람 없는 시간대에 혼자 가서 봤는데 솔찌키 오줌찔끔나옴
발신제한,lush****,7,폰부스 생각나는 영화
랑종,jkp_****,7,초반에 아무런 느낌 없이 보다가 여주 미모에 홀리면서 몰입하고 있는데 중반에 화들짝 놀라고 그 뒤로는 점점 공포가 몰입이 되면서 긴장만 하다가 푹 식어버리는 느낌이다...상영전부터 너무 띄워줘서 기대했다가 실망한 느낌이랄까?
여룡공무,adiv****,7,장민 은근 매력있음
랑종,okok****,2,어지러워서 보다 나왓어요 카메라가 심하게 흔들림 일반인도 그렇게 안찍겟음 오바이트쏠려서 죽을뻔 중간에나오는사람들 수두룩
블랙 위도우,ddau****,10,내기준 마블솔로 영화중 최고였다..진짜 몰입 되서 시간가는것도 몰랐내 와..여운이 아직남는거보면 진짜 잘만들었고잘찍었고 배우들 연기 하나하나 감정드 느껴져서 왜 사람울리게 만들고 대박이다 진짜ㅠㅠ
미스피츠,p00p****,1,2021년에 이런 쓰레기 영화를 보게 될 줄이야 역시 짱깨자본이 끼면 영화가 저질이 됨
미드나이트,reno****,2,아직도 이런 스토리 영화를 만드는게 한심할 지경
블랙 위도우,khb9****,7,일단 처음 쟈미없으니까 자다가 마지막만 보세요
애프터 미드나잇,adiv****,6,약간 독특했다
매드맥스: 분노의 도로,nolo****,10,아드레날린 폭발! 하나부터 열까지 모든게 완벽하네
랑종,gusd****,2,보다 잘뻔한 영화는 오랜만이엿네요
랑종,jazz****,10,공포영화는 이정도는 돼야죠.  엑소시스트급의 충격이 가시질않습니다. 공포영화의 수작
시간을 달리는 소녀,slsh****,9,이런 순수함은 시대와 장소를 타지 않네요 오랜만이다 이런 너낌
만담강호,wpdl****,10,내 젊음과 함께한 오인용 화이팅!!
블랙 위도우,dywj****,10,기대한만큼 재미있었어요 손에 땀남 후..
보스 베이비 2,shwi****,2,영화보다가 지루해서 잠자기는 처음!
베이비 드라이버,mins****,8,음악틀고 미친듯이 달리는 영화
블랙 위도우,jw50****,6,좀 지루했지만 낫 배드..
코스믹 씬,adiv****,2,허접하다라는 단어는 이럴때 쓰는것이다
분노의 질주: 더 맥시멈,asdf****,10,재밌고 감동적이고 최고
우리는 매일매일,nyam****,10,감동적이예요. 영화 만들어주셔 고맙습니다. 이대 졸업생인데 고대사건 말로만 많이 들었는데 영상으로 확인하니 얼마나 성인지 감수성이 떨어지던 시절인지 알수있는 부분이네요.(지금도 여전히..) 이제 시작이죠. 연대하겠습니다!!
우리들,paeo****,10,어린시절의 느꼈던 느낌을 그대로 담은 영화이다.무슨이유 때문인진 모르겠지만 조금 친해졌다고 생각하면 나랑 친하지 않은 주변 친구들과 친해서나중에는 어색한 사이까지 갔다.나는 선이 처럼 계속 이야기 하려고 노력하지 않았다 그 느낌이 너무 싫어서 회피했다.선이는 정말 대단한것 같다 그렇게 당하고 지아에게선물을 하고 끝에는 지아를 감싸준다.나는 그 상황에서 선이 처럼 용감할 수 있을까생각하게된다.  오랜만에 정말 마음에 드는 영화를 본것같다
토르: 라그나로크,sy12****,10,너무 재밌어요!!!!
사바하,pjy1****,7,던지는 화두는 뭔지 알겠으나인물들이 나를 전혀 설득하지 못했다.이단을 이용해 밥벌어 먹고사는  박목사가 살인사건에 이입을 하는 과정이 너무 얼렁뚱땅이고 굳이 정진영씨를 캐스팅한 이유를 모르겠는 반장 불사라고 하면서 고작 불에 타죽는 김제석악마처럼 묘사해놓고 개밥이나 먹다가털이 빠지더니 라이터나 전해주고 허무하게 죽는언니는 초반 태어날때 강한 임팩트의 기대감을 와르르 무너뜨린다.신이 있는가?신이 있다면 악은 당연히 존재 한다.그렇다면 신과악은 한몸인가?우리를 구원하는 존재는 신일수도 악일수도 있다.정신똑바로 차리고 사시기를 사바하스토리가 꽉찬 오컬트 무비보고싶다
프라미싱 영 우먼,chlo****,10,"누구나 인생 한번 사는데.. 억울하게, 혹은 억울해서 죽는 사람 좀 없으면 좋겠다."
이스케이프 룸 2: 노 웨이 아웃,okop****,10,
야쿠자와 가족,kusa****,10,"겐지 낭만 합격,,빅딜로와라"
블랙 위도우,rose****,10,진짜멋진거같아요.우와하면서봣네요
랑종,sh02****,4,태국판 킹덤 이것말고는 할말이 없다
야연,isfr****,2,연출만 엄청 화려하고 막장이고 재미없다 슬프긴 함
코코,kino****,10,리멤버 미....ㅠㅠ
랑종,lhl5****,8,한마디로 태국곡성~~  태국배우들과 곡성에서의 한국배우들의 디테일 한 연기차이가  너무 커보였지만  충분히 공포감 있고 괜찮았음 생각을 하게끔하는 주제와 해석은 굿
명당,zmfk****,10,재미있네요..조상묘..실제로 잘못쓰면 시체가 안썩기도하고 물이 고여있기도하더군요
아델라인 : 멈춰진 시간,okok****,8,감동적이고 재밌게 잘 봤지만 흥미진진한 소재에 비해 너무 많은걸 생략한 느낌이 좀 아쉽네요 ㅜㅜ 한번에 나타내려니 들쑥날쑥인것 같기도 하고
블라인드 사이드,olds****,10,지금 우리 한테 필요한 마음이 따뜻해지는 영화
내겐 너무 소중한 너,safe****,10,
컨스피러시,bban****,8,근데 중간에 앨리스 도망갈때 저격수가 총쐈는데 뒷통수 맞고 죽은사람누구야? 뜬금없네
바보 사냥,namb****,6,그냥 한번쯤 볼만한 괴작.
포인트 브레이크,bung****,7,"익스트림 스포츠란 기상천외한 방식으로 세계금융시장을 혼란에 빠트리는 범죄조직에 FBI요원이 위장 잡입하면서 벌어지는 이야기를 그린 액션, 범죄영화다. 1991년 캐서린 비글로우감독, 키아누 리브스, 패트릭 스웨이지주연의 '폭풍 속으로 (Point Break)'를 리메이크한 영화다. 1991년의 당시 왜 폭풍 속으로란 다소 클래식한 제목으로 국내에 상영된건지는 영화의 마지막 장면에서 알 수 있다. 폭풍우가 몰아치는 가운데 죽음마저 불사하는 보디의 서핑에 대한 애착과  보디의  마지막 소원을 들어 주는 죠니의 우정은 지금도 그 엔딩장면이 강하게 기억속에 남아있다. 폭풍처럼 강렬한 영화였고 당시 서핑에 대한 문외한인 내게 포인트 브레이크의 의미를 알게 해준 영화였다. 그영화를 본 후 파도치는 바닷가를 볼 때는 폭풍우와 포인트 브레이크라는 파도속으로 사라지는 영화속의 모습이 떠오르곤 했었다. 거의 25년만에 나온 리메이크작인 이영화는 원작을 추억하는 차원에서도 그렇고 무더운 여름에 볼만한 청량감있는 영화이기에 시의적절한 영화가 아닌가 싶다. 난 이영화를 보고나서 원작의 해석을 이렇게 리메이크 할 수 있구나하는 생각으로 영제를 거꾸로 해석해 보았다. 역발상이긴 하지만 브레이크 포인트, 브레이킹 포인트로 해석해 보니까 리메이크한 감독의 의도를 나름대로 유추해 볼 수 있었다.  원작이 스토리가 있는 드라마틱한 액션영화였다면 이영화는 스토리는 배제하고 오직 시각적인 즐거움에 치중한 액션영화라는 것을 느낄 수 있었다. 브레이킹 포인트는 한계점을 뜻하는데 영화에서는 여러가지 익스트림 스포츠를 통해서 인간의 한계없는 한계점을 극한으로 표현하고 있다. 아마도 이점이 원작과 차별화 되는 강점으로 보일지 모른다. 하지만 리메이크작의 본연의 의미를 살리지 못한 스토리의 빈곤함은 한계를 느끼지 않을 수 없다. 범죄의 방법이나 중력을 거스러는 액션장면이나 범죄를 하면서 정의를 실현하는 그들의 행동들, 그리고 실제같지 않은 여러나라의 믿을 수 없는 비경들은 분명히 브레이킹 포인트라고 해"
이스케이프 룸 2: 노 웨이 아웃,tkde****,6,노잼이에요. 돈아까웠어요...영화관에서 볼만한 영화는 아니네요.
크루엘라,km97****,10,오랜만에 영화관에서 본 재밌는 영화엠마 스톤의 연기는 가히 놀랍당.
콰이어트 플레이스 2,chan****,8,킬리언머피 팬이라 선택한 영화ㅎㅎ.긴장감 있고 좋아요.3편이 나올거 같네요.킬리언머피 봤단거로 전 무조건 만족ㅋ
해무,brai****,10,조선족은 조선족입니다
발신제한,miny****,1,발암 유발영화네요급박한 설정인데 경찰이 뛰지도 않고 느릿느릿 걸어다니고 말도 아주 점잖게 천천히 하네요속터지는 줄왜 나이든 여자 경찰을 혼제 내세웠을까?감독 와이프 인가?연기도 어색하고 영화보다가 캐스팅에 의문을 가진건 처음입니다. ㅠㅠ
결백,tota****,8,이 영화를 재미 있게 봤다. 신혜선의 연기력 배종옥 허준호의 연기가 돋보였다. 근데 마지막 연출이 미흡했다고 생각한다. 악당들 때문에 관객을 열받게 했으면 마지막에 악당들을 확실하게 벌하는 사이다성 연출이 아쉽다. 나쁜검사.조폭 악당 허준호를 살인범으로 구속되는 과정 등이 있었으면 속이 후련 했을 텐데---
블랙 위도우,july****,10,이렇게 잘 만들면.. 나타샤를 더 보낼 수 가 없잖아....
펭귄 하이웨이,kij3****,10,진짜 이런거 찾고있었다니까~!~!~!~!~
블랙 위도우,slay****,6,단발좌 고생했어요 안녕
블랙 위도우,slay****,6,단발좌 고생했어요 안녕
야구소녀,yeou****,10,자신의 가능성을 믿고 사랑하는 수인이. 어쨌거나 굴하지 않는 캐릭터의 힘이 필요한 마음이 분명 있었다. 영화의 설정일지라도 수인이가 우리 안에 어디엔가 살아있었으면 한다.
발신제한,hjil****,10,재미있네요. 긴장감도 있고. 차 안이라는 내부 설정을 통해 긴박감을 준게 인상 깊었음.
혐오스런 마츠코의 일생,pes6****,10,마츠코의 일생은 혐오스럽지 않았다
랑종,ha_p****,1,솔직히 별 반개도 아까움 ㅋㅋㅋ스토리가 탄탄한것도 아니고 무섭지도 않고 그냥 노잼 영화
치외법권,idkh****,5,상황과 인물간의 연계성이 매우 약해서 아쉬웠다.
킬러의 보디가드 2,ki_l****,6,"한 마디로 더럽게 지껄이고만 자빠졌네 진짜 날로들 쳐 먹으려고. 평식이가 간만에 맞는 말 했네 왜 '아가리'라고 비아냥 댔는지 알겠다. 휴... 참, 기대 많이 하고 쟁여봤는데."
설국열차,no91****,9,생각할 거리도 있고 볼만합니다. 중간에 약간 생뚱맞게 느껴지는 부분도 있긴한데 일부러 넣은 느낌
발신제한,kse4****,10,조우진 배우님 연기 너무 잘하세요ㅜㅜ진짜 너무 재밌게 봤습니다!
언더 씨즈,fanu****,10,UDT/SEAL 한국 해군 특수부대 인데 . 언더씨즈 영화에서 스티븐시갈이 한국 군대로 치면 한국군 해군 UDT/SEAL 부사관 계급 상사 쯤 되지
크루엘라,terr****,10,이거보고 엠마스톤 나오는 영화 다찾아봤다 ㅇㅇ
랑종,77ky****,2,이 영화 때문에 이동진을 비롯한 몇몇 유튜버 손절함
뷰티 인사이드,wlgh****,10,군대에서 애들이랑 봐서 못울었음
제8일의 밤,hell****,10,난 80년대 홍콩 영화 생각도 나면서 잼나게 봤음
이스케이프 룸 2: 노 웨이 아웃,redm****,8,참여자들이 챔피언 출신이다 보니 1편보다 빠릿빠릿하게 진행되면서 협동심도 좋은데 과연 미노스 마수가 어디까지 뻗친다는 세계관인지 궁금... 3편도 기대됩니당
잭 스나이더의 저스티스 리그,hera****,10,차라리 웨던 컷을 흑역사화 시키고 스나이더 컷을 정사처리해라
블랙 위도우,whgp****,6,초중반 진짜 너무 루즈함같이 본 친구들 전부 꿀잠 잠후반은 재밌었음이 영화가 마블ip 빼고 똑같이 나왔다면정말 흥행했을까 함 솔직히 평점 9점대는 절대아닌 영화 오직 마블빠들이 점수 올려주는 거지
너의 이름은.,wndu****,10,
발신제한,1t0t****,2,"사기친 놈은 살아남고, 사기당한 놈은 죽고.. 기분이 더러워졌다"
"부르고뉴, 와인에서 찾은 인생",iuni****,8,그냥저냥 소소하게 볼만함 전원일기 프랑스버전을 보는듯한 느~~
랑종,mind****,1,너어무 너어무 재미 없다... 정말 너어무. 과한 마케팅의 부작용. 차라리 마케팅에 힘 뺏으면 기대라도 안 하고 가지.
원더,zldt****,10,눈물 콧물 다 빼네요 사랑스러운 어기
라따뚜이,jins****,10,"여러번 봐도 질리지 않는 영화, 파리에 가고 싶다"
지푸라기라도 잡고 싶은 짐승들,spon****,10,대박 요즘 이런 영화 너무 안나온다꼭 보세요!!
랑종,raer****,9,평점이  너무 안좋아서 솔직히 볼까말까 망설임  근데 유튜브에 나와있는 영화해석 보고 그냥 심심풀이 로 보자 했는데 솔직히 이 영화는 본 사람 마다 해석하기 나름 일듯함 감독 연출도 왠지 그런의도로 장면하나하나 만든것 같은데  한마디로  정답은 없지만 본인이 생각하는만큼의 공포인듯~ 무서우면 무서운거고 기괴하면 기괴한거고 재미없으면 재미없는 영화난 솔직히 다른 나라와 콜라보로 해서 신선하고 곡성이란 영화랑 흡사해서 아주 재밌게 봄 나중에 한번 더 볼거임  반대하는사람이 있다면 곡성이랑 셔터를 보고 너무 기대한 탓이 아닐까 생각 됨
미스 페레그린과 이상한 아이들의 집,riye****,10,진짜 재밌음  인생영화
블랙 위도우,yuko****,2,그냥 그래요. 긴 스토리로 좀 지루했습니다.
블랙 위도우,coko****,8,마블놈들아 고작 한 편 만들어주고 끝내기 있냐 ㅠㅠ
"나는 내일, 어제의 너와 만난다",sout****,10,처음볼때는 그냥 슬픈내용이 아련하게 남지만 두번째보면 시작부터 눈물이 흐른다..
보스 베이비 2,jiwo****,10,감동적이고 재미있고 시간가는줄 모르게봤음
클로버필드,phs3****,8,괴수물중에 최고가 아닌가 싶다.
발신제한,smal****,7,한국 영화는 신파 반으로 줄이고 개연성좀 똑똑하게 치밀하게 짜면 완벽해질것이다. 조우진 연기와 음악이 좋았다.
오퍼레이션 피날레,jama****,10,너무  흥미진진 하구  재밌네요
서스페리아,phs3****,3,리메이크작을 본 원작영화감독이 극대노한 이유.
별을 쫓는 아이,jung****,10,"소중한 사람을 살려야 하는 사람들의 대립, 누구도 잘못한 건 없다."
아이스 로드,bogr****,8,아이스로드에서 색다른 경험입니다... 별 내용은 없지만 볼만하네요
바후발리: 더 비기닝,kez6****,8,ㅋㅋㅋㅋ보면서 오글거리거 창피하네 노래 나올때 ㅋㅋㅋ 허세가 ㅋㅋㅋ
발신제한,luna****,7,"1시간까지 정말 쫄깃하게 봤습니다. 연기력 개 쩐다는 말들이 있어서 그래봤자지 했는데, 오... 장난 아닙니다. 진짜 쩔었습니다. 차 광고라고 하는데, 그건 전혀 동의할 수 없습니다. 스토리상 차 운전석에서 모든게 이루어지지만 차엔 전혀 관심이 안갑니다. 문제는 그 1시간이 지나고나면서부터입니다. 도대체 이 클라이막스를 어떻게 마무리를 할지 궁금했습니다.갑자기 기억에 스치는 은행 소위 방카슈랑스가 생각났습니다.아 거기까지는 괜찮았습니다.갑자기 마무리 30분을 날림으로 제작했습니다.이건 마치 자막을 만들다가 후반부쯤 가면 집중력이 떨어져서 날림으로 자막 뽑는거랑 비슷하다고 생각..아니라면 투자자들의 시간제한 압박이 있었나요?그렇지만, 마지막 장면이 인상깊기도 했네요.마지막 사고 다 수습된 후 도로에서 유유하게 차 타고가면서의 마지막 통화.아무튼 진짜 개쩔게 잘 만든 스릴러 영화가 1시간 이후부터 살짝 망가진게 아쉬운 수작 스릴러 영화입니다."
헌트,tee5****,8,"고상한 척, 아는 척 하는 놈들에 대한 경고..!"
변호인,seoj****,8,역사적인 사실을 떠나서 한 인물의 성장스토리를 이렇게 잘 녹여낸 한국영화가 몇 편이나 될까?난 아직도 송강호가 국밥집에서 돈 떼먹고 도망가려다 아이와 눈이 마주치고 나서 부둣가를 향해 달리던 장면이 생생히 기억에 남는다..
발신제한,ison****,8,조우진 연기력 아니였음 클날뻔한 영화. 조우진 진짜 연기 대대대에에에박
라라랜드,ever****,9,사랑스런여배우 멋진남배우 사랑과 현실 음악 모두 좋았네요 ㅠ
택시운전사,seoj****,5,역사적인 아픔을 떠나 초반부에서 최대한 웃기고 후반부에서 최대한 눈물을 짜내려는 영화의 흐름이 너무 진부하다고 느껴졌다.역사적 아픔을 앞에 내세운 한국의 전형적인 양산형 영화.그 시대를 직접 겪으신 분들에게 할 수 있는 가장 멍청한 방식의 애도.
랑종,zzva****,7,혹평이 많아 기대1도 없이 봐서 조금 무서웠음. 상영시간은 너무 김.
발신제한,dhdb****,1,그냥 잘찍은 제네시스 GV80 특촬물 +  답답한 스토리   이럴꺼면 예고편 만보세요  예고편이 다입니다.OO  이럴꺼면 클레멘타인 보세요 그게 더  재미있습니다. 수고했습니다.
액션히어로,lgsv****,10,ㅈㄴ 재밌는데 ㅋㅋㅋㅋ
메가로돈,wow1****,2,최악의 영화인듯 이 영화의 첫번째 문제점은 중국여배우인데 중국 여배우는 서양에서 생각하는 전형적인 아시아권 여성인데 진보적인척 포장시키며 모든 발암요소를 중국 여배우에게 넘기고 중국여배우가 하는 행동마다 주인공인 백인 남성이 구해주거나 똥을 치워줌 두번째로는 너무 고전적인 클리셰의 사용이 너무 많아서 영화 중반부터 어디선가 본거 같은데? 라는 생각만 계속 들며 김이 빠져버림 세번째로는 너무 설득력이 떨어짐 메갈로돈 두마리가 어떤 행동을 해도 지구가 위험하다 라는 느낌이 없어서 몰입하기가 너무 힘들게 만들어버림 이 영화는 장점이 하나도 없어서 평점 0점을 줄수있다면 0점을 주고싶은 쓰레기 영화
인 더 하이츠,goll****,6,"뮤지컬로도 그냥 그렇고, 댄스로도 그냥 그렇고... 스토리도 별로고... 그냥 히스패닉판 브로드웨이 뮤지컬."
야연,gksf****,10,여성관람객만 많아서 평점이 낫은건가~~
콜드 체이싱,cute****,8,코믹 액션 (조금)잔혹 복수극
신과함께-인과 연,phs3****,1,이런게 천만관객?? 수준진짜..
타이타닉,glor****,10,이거는 끊지 않고 계속 봐야해요 진짜로 중간에 끊지 않고 연속해서 끝까지 보면 여운 오집니다 진심으로 이거 꼭보세요 내인생영화야... 진심으로 많은 영화를 봐왔지만 진짜 이거 최고다 라고 느낀게 처음이었어 되게 사람이 빨리 질리는 성격이여서 영화 한번보면 다시 못보는데 이거만 7번 봤어요 진시으로 이건 세계 모든사람들이 봐야해
블랙 위도우,qwas****,10,간만에 스트레스 쫙풀리네
말모이,dmsq****,10,우리말에 대해 깊이 생각할수 있게 되었다.
지오스톰,yuio****,5,대재앙의 압도적인 영상미와 최첨단 우주 과학시설을 쌍팔년도 스토리라인에 우겨넣다.  그땐 그래도 짙은 국뽕의 감동이라도 있었건만...
스몰 솔저,chim****,8,와 완전 잊고 있었던 추억의 영화. 마침 볼 영화가 없어서 이걸 극장에서 봤음.ㅋㅋㅋ
블랙 위도우,sona****,10,마블중에 젤 재밌었어요!! 스칼렛 요한슨 매력 최고
모범시민,wow1****,8,관객은 클라이드쪽에 몰입되도록 만들었으면  닉이 클라이드에게 설득당하여 클라이드를 놔주던지 클라이드가 닉에게 설득되어 용서를하고 닉이 썩은 법을 고치고 자신이 행동에 반성을 하며 끝내야 깔끔할텐데 클라이드쪽에 몰입하게 만들고는 출세만 생각하는 닉에게 죽어버린건 너무 아쉬웠음 차라리 클라이드 시점으로 나라 하나를 농락하는 영화였다면 더 좋았을텐데...
이스케이프 룸 2: 노 웨이 아웃,glor****,10,하 마지막에 ㄹㅇ 소름돋음 보는내내 내가 너무 좋아하는 장르의 느낌이었음 너ㅜㅁ 재밌어
"지금, 만나러 갑니다",rvd8****,10,유코 그곳에선 편히 쉬세요
블랙 위도우,kasd****,10,여러분은 지금 장례식장에서 생전 고인의 지리는 4인궁을 보고 오셨습니다.
콜 미 바이 유어 네임,sall****,10,제목만 들어도 설레고 가슴 아픈 영화…너무 아름다운 엘리오…
호스트: 접속금지,jinw****,1,이해할 수 없는 평점.
랑종,wkad****,10,감독 미친 천재. 평점 낮은 이유는 단하나. 여성들의 불쾌함으로 낮은 점수 준듯. 이 처음부터 끝까지 불편함을 노린 영화임.
지오스톰,jmw6****,5,영상미는 뛰어났지만 세계를 구하는 미국이라는 90년대 헐리우드 스토리
멋진 하루,duna****,10,"지금도 서울 어느 곳에서 누군가를 웃게 하겠지, 조병운이라는 멋진 남자."
샤먼 로드,gaen****,10,자신의 운명은 스스로 개척해나가는 것이 당연한 현대인들에게 운명 [신명]에 맡긴채 자신의 삶을 살아갈 수밖에 없는 사람들을 보여주고자한 기획의도가 참신했네요.'신들의 딸들'보다 무당의 딸로 살아가야하는 그녀들의 딸들간에 형성된 공감대가 보는 사람으로하여금 안타까우면서도 희망적이네요ㅡ굿을 한 사람들에게 일어난 변화를 카메라에 담고자했으나 그게 잘 전달되지 않은 점은 아쉽네요.후속작을 기대해보겠습니다.
다만 악에서 구하소서,yaky****,7,광기 어린 레이의 눈빛
말할 수 없는 비밀,woon****,10,여운이 많이 남는영화... 영화 여러번 보는거 안좋아 하는데 이 영화는 여러번 보게 만드네요 추천합니다~!
랑종,miss****,2,지금나랑..장난하냐
빛나는 순간,soys****,10,너무 좋은 영화에요
클래식,spee****,10,한국적인 로맨스의 표본
