영화제목,아이디,평점,댓글
자전차왕 엄복동,pjaa****,10,"아니 감상평들 다 왜 그래 이 명작을 몰라보네 여러분 이 영화는 명작입니다 리뷰들 다 무시하고 한번만 봐 주세요 연출, 배우들 연기, 스토리, 영상미, cg 하나 빠지질 것 없이 명작 그 자체입니다"
보스 베이비 2,jsq9****,10,가족들이랑 보기 좋은 것 같아요^^
해리 포터와 마법사의 돌,limz****,1,"와~ 영어공부할려고 다운받았는데, 처음부터 영자막 오류 뭔가요..5000원주고 다운로드받았는데 잘들리는 시작부터 영자막 오류가 있네요...진짜 어린이들 교육용으로 보여줬다가 애들한테 이상한 영어 알려줄뻔했네요... is 뭔가요 딱봐도  do you think로 나오는데 내가 들어도... so는 뭔가요 이거 혹시 영자막만들때 들어보기는 하시고 만든건가요... 아니면 구글에다가 검색해서 전부 다 캡처해서 만든건가요... 보다가 당황스럽네요..."
보스 베이비 2,leem****,10,오랜만에 정말 재미있었던 영화
보스 베이비 2,nbvy****,10,이번 편도 역시 흥미진진ㅎㅎ 역시 보스베이비!
보스 베이비 2,bemp****,10,가족의 소중함이 무엇인지 가슴 깊이 느낄 수 있었던 영화
블랙 위도우,kwoo****,8,실망도 없지만 재미도 그저그런 정도... 무난한 재미. 그냥 무난 무난 무난...
블랙 위도우,bbir****,10,긴말 안한다.마블이 마블했다.
하울의 움직이는 성,wate****,10,내 인생영화....하울 사랑혀....
뮬란: 전사의 귀환,earl****,10,"전쟁 이면의 슬픔에 먹먹해집니다. 조미의 연기도 좋고, 천쿤의 눈빛이 계속 남네요.별다른 기대없이 봤는데, 잘만든 영화 한편입니다."
블랙 위도우,hejz****,10,믿고보는 마블입니다.
랑종,sue3****,2,무당 3남매의 연기는 매우 볼만합니다만 에이스 몇이서 캐리할 수는 없을정도로 판 자체가 구립니다. 페이크다큐의 형식을 빌렸으나 중반부부턴 틀 따윈 개나 줘버리고는 스스로 엑소시즘의 아류작 수준으로 떨어져버립니다. 처음의 깊이있는 분위기와 아슬아슬한 긴장감은 어느새 사라지고 다소 역겨울 수 있는 시각적인 자극만 남아요. 조연들은 어떤 저항의식도 없이 영화 내내 아주 순종적으로 트롤짓을 일삼아 이게 공포를 주는 영환지 스트레스를 주는 영환지 헷갈리게 하고 여러 복선 요소들도 두어 번씩 보여주는 데다 연결고리도 1차원적이고 직관적이라 여운이랄 것도 안 남습니다. 페이크다큐 형식을 차용했으면 처음부터 끝까지 현실속에서의 비현실을 비춰 잡스럽고 단순한 시각적 공포 대신 미지에서 오는 아련한 공포감을 살리는 게 훨씬 좋지 않았을까 싶네요.
랑종,ball****,1,그냥 보고나면 비위 상하는 영화
랑종,nkuh****,10,오컬트물 좋아하시는분들은 좋아하실듯 처음부터 무서운게 아니라 점점 조금씩 빌드업시키기에 긴장감이 점점 고조됨 나는 굉장히 재밌게봤음 밍 역할 배우도 연기잘하고 기괴하고 처참하고 비극적인거 좋아하는분들은 보시면됨
클레멘타인,sv90****,10,눈물을 훔치게 만드는 걸작
크루엘라,oneo****,10,"크루엘라 드빌, 멋지당"
보스 베이비 2,free****,6,조금 지루하고 졸렸음.아이들은 한 명은 재미 있어했고한 명은 지루해했어요.
보스 베이비 2,r4ky****,10,생각보다 더 재밌고 보는내내 흐뭇하게 봤습니다
보스 베이비 2,pzw3****,10,아기들이 귀엽고 사랑스러워요~~
보스 베이비 2,pnao****,9,3편도 기대가 되는 보스베이비!
룸,sall****,1,쓰레기 같은 영화 여주는 ㅈㄴ이기적임
보스 베이비 2,d3r0****,10,귀엽고 재밌고 스토리 탄탄하고 굿!
랑종,cand****,7,중반부 기점으로 완전히 영화 색이 달라집니다. 재미있어요!
새콤달콤,ssin****,10,신선하고 재밌음. 손이 잘 안가는 영화인데 일단 보면 시간 순삭
좀비크러쉬: 헤이리,nba1****,6,"저예산이라고는 하지만, 아쉽네. 연출,스토리 아쉬움."
랑종,suns****,4,"결국 나홍진의 곡성은 실력이 아닌 우연이 었구나. 앞으로 나홍진 영화는 내려 갈일만 남은 듯..보다가 시계3번 봤다..., 아듀 나홍진..."
그것만이 내 세상,tvnu****,10,잔잔하게 연결되는 분위기에 무뚝뚝한 간결함에  깊이있는 연기는 감동속으로 빠져든다.
카메라를 멈추면 안 돼!,shae****,10,"기나긴 롱테이크에 박수를, 만드는 과정에는 웃음을"
내일의 기억,nba1****,8,"반전도 좋고, 연기도 좋고...흥행이 아쉽네...뭔가"
새콤달콤,nba1****,6,나름 볼만. 반전도 좋구. 이경영역할이 먼지 모르겠음.
랑종,cjsw****,1,"연출 연기 스토리 영상미 OST 모든게 최악.인데, 뭘 감상포인트를 추천하라는건가요ㅡㅡ"
피닉스,tron****,10,
푸시,phyo****,10,엄청재미남 각자 개취이니 평점낮은분은 지가좋아하는 영화나보세요
발신제한,hyej****,10,조우진 연기력 몰입감 짱이네요 마지막엔 인생교훈도 주네요
현기증,tron****,10,
주성치의 심사관,ckex****,6,지금기준으로 보면 너무 유치함
신의 한 수: 귀수편,kimp****,3,말죽거리 바둑사
보스 베이비 2,work****,10,오빠랑 가볍게 보러갔는데 마지막에 독창할때 소름이 쫙 돋았네요 3편도 나왔으면
더 테러 라이브,smil****,10,와 하정우 연기가 더 긴박감을 살린다
블랙 위도우,tjfx****,8,재밌게봣습니당
혼자 사는 사람들,dbro****,10,"""밥이나 같이 먹어요.""라는 대사가 와닿네요.이 시대를 비추어볼 수 있는 영화!"
굿모닝 에브리원,y507****,10,밝고건강한내용이라 울딸한테 추천
아비정전,joyr****,8,
랑종,shar****,4,솔직히 기대를 많이 하고 봤는데 실망이 크네요 결말이 좀 허무합니다 … 똥을 싸다만 느낌
낙원의 밤,nuno****,7,마지막 장면 사이다 ~!
룸 이스케이프,seri****,7,"제목처럼 방 탈출 게임에 관한 영화이다. 방탈출을 주제로 한 영화의 경우 폐쇄된 공간이 배경이기 때문에 영화 초반 진행이 잘못되면 자칫 지루해질 수 있는 장르이다. 이 영화도 초반에는 좀 지루하자민, 중반 넘어가서면서 긴장도는 높아진다. 하지만 이해하기 어려운 결말로 인해 뭔가 아쉽다."
양자물리학,kais****,10,
도라에몽: 스탠바이미 2,tjdp****,2,노잼이에요 영화말고 일반 애니메이션으로 나오는 내용 그대로 갖다 붙혔고요 그다음부터는 그냥 스탠바이미 1 때 나오던 내용과 비슷해서 신박성도 없었고 매우 지루했어요 보실분들은 기대 안하고 보시는게 좋을듯;;
블랙 위도우,bloo****,10,"연기, 연출, 스토리 뭐 하나 빠지는게 없네요! 최고ㅠ"
발신제한,choi****,1,"너무 허술함.현재 자신의 상황을 범인이 모르게 얼마든지 외부로 알릴 수 있는  방법이 너무도 많은데... 그냥 끌려감.차주의 인척이라고 나타나는데, 우리나라 경찰은 인척이라고 하면 바로 믿어주나봄. 얼척이 없더군."
피에타,snak****,7,영화를 평가하라니까 감독을 평가하고 자빠졌네. 김기덕 작품치고 괜찮은 작품이고만 영화도 안보고 1점 박는 애우들
스카이라인: 라스트 워,dong****,1,진짜 웬만해선 리뷰 안쓰는데...이건 정말 한숨밖에 안나옵니다. Sf 좋아하는데도 이건 정말 재미없게 봤어요. 1편은 괜찮았는데 그 좋은 소재를 토대로 어거지로 스토리 이어나가려다보니까 점점 산으로 가고 개연성도 없고 cg도 똥퀄에 분장은 무슨 아기공룡 둘리수준ㅋㅋ 감독님 똥은 집에서 싸세요 영화에서 싸지말고
콰이어트 플레이스 2,lhb2****,8,1편 못지않게 재밌었어요~ 3편도 기대해봅니당
비와 당신의 이야기,meta****,1,이 배우들을 모셔다가 뭐하는 짓이냐 감독이냐 테러리스트냐
보스 베이비 2,daye****,10,
추억의 마니,gpff****,10,서른이 넘은 지금도 감동을 느낄 수 있는 애니메이션을 만나게 되어 행복합니다.
비포 선라이즈,yeon****,10,
아이스 로드,skan****,9,빠른 전개에 몰입도 최고! 시원한 액션과 박진감 넘치는 추격신으로 흥미진진. 음악도 좋고 악당이 등장해서 긴장감 고조되고 진지한 시사점도 콕 박아둔 스토리이다. 추천!!
비포 선셋,yeon****,10,
애프터 라이프,bung****,7,"모두가 죽었다고 알고 있는 여자는 처음엔 장의사를 의심하지만 차차 삶과 죽음의 착각에 빠지게 된다. 과연 장의사의 체면이나 약물로 인한 것인지 아니면 정말 그녀는 죽은 영혼인지 혼란에 빠진다. 그녀가 자신이 죽었다는 것을 의심할 때마다 자신의 신비한능력을 이야기하면서 너는 이미 죽은 존재라는 것을 계속해서 주입시킨다. 삶은 고통이고 죽음이 치료제라는 그의 말에 동조되어가는 여자는 어느순간 모든것을 체념한다. 하지만 삶의 본능은 그녀의 의심에서 꿈틀대고 영화는 밑고 끝도 없는 미스터리 함정에 빠지게 한다. 죽는 이유를 묻는 여자의 질문에 삶을 중요하게 만들기 위해서란 장의사의 말은 엘리엇이 영화속에 보여주는 주술처럼 사람을  세뇌시키는 죽음보다 삶이 더 두려운 것이다란 말과 맥이 닿아 있다는 생각이 든다. 그러나 여자의 체념속에는 여전히 한가닥 삶의 집착일까? 아니면 본능 일까? 의심이 자리잡고 있다. 죽는다는 것은 삶의 고통의 완전한 소멸이라고 알고 있었는데 여전히 그고통은 죽었어도 멈추지 않는다. 이영화의 구성은 정말로 단순하다. 영안실에서 깨어난 여자, 자신이 죽었다는 말을 듣게 된다. 그리고 정말로 죽었는지 대한 의심의 끝없는 탐구로 전개되는 단순구조다. 그러니까 영화는 사실 시작도 끝도 없다. 그리고 결말이 반전인지 아니면 여자는 이미 불행한 죽음을 맞이한 존재인지가 분명하지 않다. 이것은 정녕 관객이 판단할 몫인지 모르겠다. ""넌 시체야, 이제 더이상 네 의견은 중요하지 않아"" 이 대사만 놓고 보면 관객의 몫을 철저히 깔아 뭉개는 듯 보인다. 그래서 장의사는 죽지 않은 것을 죽이려는 사이코패스처럼 보이다가도 신비로은 능력을 가진 영매자로 보이기도 한다. 애프터 라이프는 사후세계를 의미하지만 이영화는 사후세계를 이야기하지 않는다. 나는 특히 영화제목에서 After. Life에 특이한 점을 발견했다. 그냥 Afterlife라고 하면 분명 사후세계이지만 After 다음에 마침표를 찍고 Life를 대문자로 시작했다는 것이다. 이것은 분명히 궁금증을 유발"
용길이네 곱창집,eunh****,10,"영화를 보는 내내 할아버지가 생각났다.  성인이 되어 가족들을 통해 어슴푸레 들어 알게 되었던내 할아버지의 이야기나의 할아버지는 일제 식민지 시절에 태어나셨고, 태평양 전쟁의 광기속에 일본 어딘가로 징용을 가셨다. 고된 환경을 견딘 후 기적같이 그곳을 탈출하여 고국으로 돌아오셨지만, 6.25 한국전쟁의 소용돌이 속에 빠져들 수 밖에 없었던 내 할아버지 비단 이 영화는 내 할아버지의 이야기만은 아닐 것이다 비극의 근현대사를 살아오신 우리들의 할아버지 할머니의 이야기일 것이다점점 잊혀져가는 우리 할아버지 할머니들의 아픈 이야기를 영화인들이 꾸준하게 영화로 만들어주셨으면 좋겠다. 일본 최고 배우들의 열연으로 더욱 더 여운이 길게 남는 영화이다이렇게 좋은 영화를 늦게 알게 되었지만, 오래도록 가슴속에 간직해 두며 꺼내보고 싶다"
랑종,city****,1,나홍진이 태국사람들과 같이 미끼를 던졌고 내가 그걸 낼름  덥석 물어버렸네 짜증나게  보는동안 하품이 멈추질 않는다
블랙 위도우,zxcv****,8,블랙위도우의 어린 시절을 알수있는 영화. 감동적인 부분도 있어서 재밌게보았다.
블랙 위도우,wnst****,7,중간에 너무 졸림
원더,gong****,10,영화를 보는동안 입에선 웃음이 눈에선 눈물이 났습니다
범죄의 여왕,sohj****,7,범죄의 영화라는 제목만 보고 봐서 솔직히 여자가 범죄 저지를줄 알았는데 추리물일줄 몰랐슴 개태 캐릭터가 넘 귀여웠씀
랑종,even****,10,사람들이 왜 악평을 쏟아내지. 직접 보면 생각 달라진다. 강추!
랑종,wjdt****,10,후반부의 아쉬움과는 별개로 초중반까지는 매우 좋았다.
인페르노,dltm****,9,다빈치코드-천사와악마-인페르노로 이어지는 영화 잘 봤습니다 :)
랑종,craz****,10,"후반부가 잔인한건 공감하나 이 영화의 백미는 후반부 잔인한 부분이 아님,귀신이나 툭 튀어나오는 평범한 공포 클리셰 없이,'아,,,이 장면 뒤에는 이런 연출이 이어지겠구나' 하는 예상이 가능하면서도, 막상 보기 힘들어지는 심리적 압박이 대단함, 잔인해서라기보다, 예상되는 흐름을 이끌어내는 '과정'이 무서운 영화"
보스 베이비 2,gong****,10,"함께하면 얼마나 행복한지,그리고 가족의 소중함을 알게해준 영화이다."
박수칠 때 떠나라,joma****,8,요즘 나오는 영화들보다 훨 재밌었어요. 가끔 코믹한 대사들 웃기고 ㅋㅋ 배우들 젊었었네요. 연기는 그때도 넘나 훌륭하고요
불어라 검풍아 - 감독판,im_1****,10,그냥 생각없이 이거 뭐지? 하고 봤는데 검술 액션이이렇게 자연스러울수도 있구나 하면서 봄. 배우들 연습을 얼마나 했을까..
이터널 선샤인,wogn****,10,너무 좋아.... 내일도 봐야지
체르노빌 1986,gusl****,1,평점 알바쓰지좀 마세요; 안타까운 사건에 이상한 로맨스를 섞어 망친 영화에요 로맨스 감정선을 하나도 이해할수없엇네요 마지막에 원전사고 작업자들을 위해바친다라고쓰여잇던데 그러면 이렇게 만들지않아야하는거아니에요?;러시아영화들다이런지 궁금하네요
암살,kell****,10,진짜 개인적이긴 한데 일제강점기 영화 중에서 이게 탑인듯 1도 지루하지 않고 너무 재밌었음
블랙 위도우,whda****,10,마블 초장기부터 마지막까지 없어선 안될 히어로...이젠 못 보는게 제일 아쉽다
블랙 위도우,asim****,9,"나타샤와 옐레나의 케미가 재미있었음 ~ 기존 마블보다 액션감이 살짝 떨어지긴 했지만, 그래도 마블 영화 만큼 볼만은 했습니다. 오랜만에 마블보니 반가웠습니다."
보스 베이비 2,calk****,10,귀여워 역시 보스베이비는 ㅋㅋ
더 웨이 홈,pdso****,10,쩔뚝거리는 다리로 마침내 벨라가 병원에 들어가서 재향군인들 만나는 순간부터 엉엉 울게 됨 ㅠㅠ 너무 고생했어 벨라야~처음부터 끝까지 개의 시점으로 연출해서 신선했고 단순하면서도 따뜻하고 감동적인 것이 힐링이 된다^^
보스 베이비 2,nrex****,10,보스베이비1보고 보러갔더니 연결되는 느낌이어서 더 좋았어요!
블랙 위도우,yeji****,10,
보스 베이비 2,gfky****,10,정말 재미있어요. 1도 재밌게 봤는데 제 취향으론 2가 더 재밌는것 같아요.귀엽고 노래도 좋아요ㅠ 마지막 장면이 인상깊었던..
블랙 위도우,qpdl****,10,"스칼렛 요한슨이라는 이름으로 다 끝났다. 꼭 아이멕스에서 보세요. 여성감독, 여성배우들의 마블을 이런 색감입니다"
보스 베이비 2,vffl****,10,시작부터 끝까지 이렇게 단 한순간도 멈춤 없이 본 애니는 처음인듯
캐시트럭,tnr3****,10,믿고보는 제이슨 스타뎀 너무좋아요
액션히어로,rewi****,5,"씩씩한 선배 독립영화들에 비해, 전반적으로 영화가 의기소침해 보였다."
랑종,fftp****,7,"신림롯시] 초반에는 뭔가 분위기 있었는데 중반 넘어서까지 꽤 오래 지루했다. 그리고 언제나 화면 앞에는 촬영진이 있다는 생각이 들어, 사실성을 부여하려는 '페이크 다큐'라는 형식이 오히려 공포감을 감소 시키는 원인 이었다. 여기다 맥락이 이해안가는 장면들 몇 개 접하니 상황과 더욱 더 거리감이 느껴졌다. 뭔가 불쾌감을 주는 영상들로 비위 상하게 하려는 의도만 느껴졌다. 그래도 뭔가 분위기 있는 연출이나 음향은 꽤 공포스러웠다."
랑종,ares****,8,사실 호불호는 나뉘지만 난재미있었음 전형적인 오컬트..곡성 프리퀄 정도 곡성이 무섭지 않았듯이 딱그정도 하지만 찝찝한 느낌정도..추천
랑종,sonh****,2,"제작비가아까운 영화 입니다.별점도 마이너스라도 아깝고요.시간과돈이 남아돌아도 보지마시길 .3류?B급? B급은 B급의 감성이라도 있죠...이건그냥 오물입니다.대한민국의 수준있는 국민이보기엔 심히 격떨어지는 영화인지라,제양심이 시키는대로 생전처음 리뷰 작성합니다.여기좋은평 주신 저명한평론가분,댓글알바분들,나감독 친인척?분들..ㅋ부디 양심챙기시길..벌받습니다그러다..셔터?곡성?그건 오히려아카데미감 이었네요ㅋㅋ제딴엔 충분히설명한듯 합니다.여러분의 시간과돈은 매우 소중합니다."
랑종,hand****,4,좀비 영화인줄 알았다.... 그래서 영화의 교훈은 죄짖고 살지 말자 이런뜻 ㅋㅋㅋ
크루엘라,noen****,8,엠마가 엠마한 영화
랑종,ejrr****,10,재밌어요 사람마다 다른거니까
새콤달콤,pkjh****,10,
더 폴: 오디어스와 환상의 문,youn****,10,몇년이 지났는데도 잊을 수 없는 영화. 구글리 구글리 구글리!
블랙 위도우,noen****,7,마블의 끝물
이스케이프 룸 2: 노 웨이 아웃,july****,10,1도 재밌었지만 2는 진짜 심장 쫄깃하네~ 강추!
크루엘라,dbru****,10,
세 얼간이,noen****,10,All is well.
콰이어트 플레이스 2,al2d****,8,확실히 1편이 더 짜임새 있고 재밌음..그렇다고 2편이 크게 떨어지는건 아니고 확장판 느낌~그만큼 신선도는 전편보다 떨어져서 아쉬움..
블랙 위도우,mode****,9,"다른이들에게 어떨지 몰라도, 나에겐 완벽한 서사의 블랙 위도우였다. 차세대 블랙 위도우도 기대가 된다!"
솔저 발터,kh39****,10,
낙원의 밤,bhr0****,8,여백의 미를 너무 주신 낙원본색
랑종,suno****,1,진짜 웃기고 앉아있네쓰레기 중 상 쓰레기
아이리시맨,seoj****,10,"영화가 던지는 메시지가 보여줄 수 있는 최대한의 힘을 보여준 영화.마지막에 반쯤 열린 문틈 사이로 보이던 로버트 드니로의 늙은,그래서 한없이 순해 보였던 그 모습이 계속 기억에 남는다."
랑종,oxk1****,2,도대체 왜 다큐인건가요? 그냥 삼류 좀비 영화인듯
랑종,cx34****,9,기대를 안하고 봤더니 나름 여운도 있고 재미도있습니다6점대는 아닌것 같고 7점대가 적당한 영화
보스 베이비 2,h0jt****,10,모 처럼 아이들과 즐거운 관람이였네요^^
보스 베이비 2,keng****,10,초3 아들이랑 같이 가서 봤어요~ 아이가 보스베이비 1편을 10번은 본거같아요. 완전 팬이라 2편 개봉한다 소식 듣고 바로 예매해서 봤는데 하하하 아들이 보는 내내 깔깔 대며 웃고 신이 났더라고요. 아주 재밌었다며 엄지 척! 거기다가 부성애 코드도 들어있는 바람에 중간에 울컥해서 저는 눈물을 줄줄 흘렸네요. 러닝타임 내내 지루할 틈 없는 시간이었습니다~^^
아수라,wnjt****,10,좋은데? 개인적으로 내 취향
발신제한,snrs****,10,조우진님 연기만으로도 진짜 쫄깃쫄깃하고 긴장감 미친 거 같음ㅠㅠ몰입도가 높음 그리고 라켓소년단도 애청중이라ㅋㅋㅋ귀엽고 연기 잘 함
불량남녀,momo****,10,영화가 재밌는데 받아보기가 힘듦니다  하루빨리vod로 볼수있게해주세요
어드리프트:우리가 함께한 바다,yun2****,10,여운이 많이 남는 영화...
랑종,jiaa****,6,결론. 밍은 너무 이쁘다... 개이뻐
태풍태양,lhs7****,10,청소년 영화로 매우 건전하고 잊혀지지 않는 감동이 있습니다.
클로버필드 10번지,jeni****,6,결말만 좋았다면 9점 넘는 영화
꽃다발 같은 사랑을 했다,gahy****,10,너무 제 취향의 영화라 두번 봤는데 중간에는 막 슬픈내용은 없지만 중간부터 울면서 봤어요 여운이 남고 자꾸 생각나는 영화예요 ost 멜론으로도 들을 수 있었으면 좋겠어요ㅠㅠ
오로라 공주,jm2d****,6,역시 엄정화는 예나 지금이나 섹시함!!
섀도우 클라우드,yome****,1,"영화를 너무 좋아해서 보다보다 이제 정말 볼게 없다할때, 할게 너무 없어서 뒹굴다뒹굴다 너무 심심해서 그냥 티비라도 켜놓고 싶을때, 그냥 아무생각하고 싶지않을때, 에도 너무 재미없음.."
대환장파티,daso****,10,볼만합니다. 재밌어요!
하녀,ehrk****,10,전도연 윤여정 연기하나로 10점 아니 100점.. 내용은 기억 안난다 그냥 순수하고 해맑았던 전도연이 악녀로 변해가는 모습과 윤여정의 미안하고 안쓰러운 표정이 잊혀지지않는다
블랙 위도우,kimk****,8,무난히 재밌다. 마블영화 같은 느낌이 아니었다. 분위기가 꽤 무거운 느낌이었다.
쿵푸팬더3,thdu****,10,진짜 핵재밌다....
쿵푸팬더3,thdu****,10,진짜 핵재밌다....
보스 베이비 2,youn****,9,재밌는데 더빙은 보지 마세요
인간중독,jsst****,6,조여정담배씬 젤좋음  조여정다시봄
랑종,dcho****,10,나홍진은 보물이다. 국내 원탑.
국제수사,wltn****,10,"배우분들 연기가 너무 좋았고, 몰입도가 높았던 영화였습니다 ~"
랑종,mona****,6,내돈주고 본 후기입니다~여주인공에게 너무 과한걸 시킨거같은 느낌아닌느낌~~~~ 그래도 전 이여름 잘 보았어여 병맛같지만 그래도 서늘했어여
랑종,exit****,4,초반에 좀 지루하고 중반부터 공포영화같은데...사운드랑 갑자기 나와서 놀라는거 빼곤 없슴 여주가 이쁨 중간에 상의노출나오는데 그래야 했엇나 싶고 후반에 각종 공포영화 짜집기 rec 좀비 엑소시즘 소머리잡고 흔드는건 곡성같고 연기는 좋았슴 다들 연출이 올드함
인비저블맨,akpl****,10,이 영화가 재밌는지는 모르겠고 여친이랑 이거 같이보다가 한시간 반동안 키스함
혹성 탈출,xhrn****,7,박스오피스 모조 보니깐 흥행에 성공했네
은혼 더 파이널,hell****,10,첨엔 작화때문에 낮설었지만 은혼은 은혼이다
랑종,gkzn****,5,이거 왤케 평점 높음? ㅋㅋ갠적으로 선호하는 장르라 반갑게 보긴했는데 비슷한 장르의 영화에서 많이 본 장면들이 많이 나와서 좀 식상함초반 빌드업 중에 여주가 이뻐서 몰입감이 좋은거 말고는 잘해야 평타아님?
보스 베이비 2,nto5****,10,1편보다 훨씬 재밌었다 강추ㅋㅋ
보스 베이비 2,bjqu****,10,힐링되어서 기분이 업!! 간만에 영화 보고 기분이 좋아짐+_+
발신제한,wjst****,10,남자주인공분 연기가 진짜 좋았습니다
랑종,furr****,1,무당으로 시작해서 좀비로 끝남. 허무 허탈
보스 베이비 2,dcqk****,9,좋았습니다. 잼나네요.
블랙 위도우,hipo****,10,역시 마블 + 서사의 탄탄함 + 귀염뽀쨕 옐레나와 R-jangnyeo 냇의 콜라보 좋았어요
블랙 위도우,8you****,10,초반 아역 시기나 중반 가족상봉 했을때는 좀 지루할 수 있지만스토리상 필요한 부분이라고 생각하고 재밌게 봤어요~!!액션은 말할것도 없이 재밌습니다. 특히 후반부 공중씬은 시원합니다 ㅋㅋㅋㅋ
보스 베이비 2,eysu****,10,여전히 사랑스러운 베이비들
은혼 더 파이널,atar****,2,어떤 시각에서 봐야재미있다는건지 .. 마니아 층이 있다는것에 깜놀.이것저것 애니 느낌나고 산만한 느낌에 에니.전 추천안합니다.
보스 베이비 2,iun2****,7,재미있었지만 정신이없고...왠지 마다가스카  펭귄의 문어박사도 생각나고 ...암튼 여러애니가겹쳐져 문득문득 생각남
랑종,gwen****,2,다큐 형식이라 카메라 무빙 때문에 굉장히 어지럽고 멀미 납니다. 나홍진이라서 봤습니다.
카메라를 멈추면 안 돼!,dhal****,10,처음볼땐 뭐지 싶다가 뒤에 기발한 기획에 감탄하는 영화 그뒤 한번더 보면 재미가 두배
용의자 X의 헌신,poiu****,9,영화 끝나고 엔딩크레딧 올라가면서 나오는 눈내리는 영상에 멍하니 벙쪄있는 내 얼굴
경주,liec****,10,세번본 영화경주시를 좋아해서 한번독특한 분위기가 생각나 두번도데채 무슨 내용일까 이해 해 보려고 세번또 다시 보고 싶은 영화 입니다
델마와 루이스,pont****,6,지 아이 제인과 함께 리들리 스콧의 대표적인 페미작.총 쏴대는 미쿡 아지매들.ㄷㄷ
