영화제목,아이디,평점,댓글
모가디슈,dla4****,8,기다리다 개봉날 보았는데 무섭지도 않고 슬프지도  않고 볼거리많은 조인성도 나오는 영화다운 영화보았습니다
모가디슈,btdh****,4,배우와 감독의 네임벨류 치고는 아쉬움
방법: 재차의,kdh3****,10,재미있게 감상했다 드라마로 시즌제 나왔음....
방법: 재차의,gamg****,7,살아있는 시체라는 점에서는 특이하다 싶었는데 생각보다 임팩트가 없어서 아쉬웠음
모가디슈,hyeb****,10,김윤석배우 보러갔는데김윤석은 말할 것도 없고다른 주연배우분들도 미치게 연기잘해서 두시간 내내 시간가는줄 모르고 봤습니다.정말 추천합니다.
방법: 재차의,gudt****,6,별로여 시시함 뻔한스토리
모가디슈,jc52****,6,이 영화 알바 풀었음? 이정도로 재밌다 소리 들을  정도는 아닌데.
블랙 위도우,ttl9****,10,간만에 본 마블.. 간만에 즐겁게 봄.
모가디슈,cant****,2,"혹시나 했는데 역시나..아쉽지만 아직 먼 한국영화연기력은 괜찮으나 연출, 전달, 서사 등 모두 억지스러움 ㅠ"
모가디슈,sang****,7,확실한건 재미는 기대하지말고 봐라 기대하면 실망한다
방법: 재차의,seon****,10,이 영화를 일 년이나 기다린 보람이 있어요
블랙 위도우,key8****,10,피가 안섞여도 가족이 될 수 있다
랑종,madd****,10,영상에서 지속적으로 희뿌옇고 탁한 부분과 초반에 지루하고 뻔하게 흘러가던 내용이 갑작스럽게 변하면서 후반부는 거의 질겁하고 봄
장군의 아들,swo0****,10,
카운트다운,skau****,10,평점이 왜이리 낮지? 8점대는 되어야한다고생각해 올리려 10점줌. 자극적인 소재나 화려한 액션씬보다는 스토리에 집중했다고 봄. 몰입도 있었고 마지막엔 잔잔한 울림을 준 영화였음.
방법: 재차의,uj38****,1,평점 보고 갓다가 제 돈 26000원 도난 당했어요 시간이탈자 볼때도 극장 이탈 안했는데 난생 처음으로 극장 이탈하고 갑니다. 진짜 평점 사기치지 마세요 진짜
보스 베이비 2,gmlt****,1,재미없고.많이지루합니다..평점이왜높은지 모르겠네요.
정글 크루즈,qp5u****,10,유쾌 상쾌 통쾌! 올 여름 휴가는 정글 크루즈로
정글 크루즈,i1ny****,10,드웨인존슨 넘 귀여웡 ㅋㅋㅋ
방법: 재차의,chlw****,10,보는내내 재밌었어요!좀비보다 더무서운듯..  꿀잼 b코로나시국에 개봉해서 아쉽...
블랙 위도우,como****,8,영화 재미있게 봤습니다. 그런데 스토리가 정신이 없네요.
스시 장인: 지로의 꿈,zxc7****,8,장인이 일을 대하는 태도에 대한 존경심과 한편으론 '왜 저렇게까지?'하는 의구심이 들었습니다. 관람후에는 지로의 삶에 빗대어 내가 살고 싶은 삶 그리고 행복이란 뭘까 하는 생각을 해봅니다.
모가디슈,suha****,10,올해 본 것 중 최고의 영화
모가디슈,east****,10,아주 슬픈 영화였다!이념을 떠나서 동포애가 느껴지는그런 영화였고 서로 헤어지면서 잘 가라고말 도 못하는 분위기가 너무 싫었다!
파이프라인,jeem****,10,주연배우 연기가 인상적이었음
랑종,fiel****,10,무서운 것도 무서운거지만정말 꽉 차게 잘 만든 영홥니다.조조할인으로 11관 극장에 손님은 나 혼자였던 거 같은 기분인데뒤돌아보면 누가 있을까봐 가만히 앉아서 쉬만 참았습니다.사무실 CCTV는와 집 CCTV는 다른의미로 지렸습니다.사랑해요 밍!
모가디슈,viva****,10,한국 영화에서 이렇게 아프리카 대륙의 배경을 담아냈다는 것에도 의미가 큰데 내용도 군더더기 없이 깔끔하고 재밌습니다.
모가디슈,suha****,10,재밌으면서 마지막은 감동적이었습니다
랑종,2jy6****,6,영화 내공이 낮아서 감상후 ? 가 나왔는데 리뷰어들의 해석 영상을 보니 조금 낫긴 하네요... 그래도 곡성보다 추리나 해석이 어려워서 평범하게 영화 가끔씩 보는 제 입장에서는 아쉬움
모가디슈,rnjs****,10,좋아하는 감독에 좋아하는 완벽한 배우들까지 최고 ㅎ
B급 며느리,nej3****,10,"시엄니.. 여자는 남편을 하늘 처럼 떠받들어야하고 남편이 기상하기전 여자는 일찍일어나서 청소도하고 화장, 머리도 싹~하고 항상 준비하고 있어야한다고 잔소리 ㅈㄴ하길래 ""어머님 부부는 평등한 관계죠 반려자지요""했더니 아무말 못하심ㅋㅋ 사이다ㅋㅋ"
실크 로드,zose****,5,먼놈에 유치원생 등록금이 4천6백이나 하냐??
방법: 재차의,dmsd****,2,보지마세요 차라리 랑종이랑 블랙 위도우 두번 보겠음 하
프레셔스,idun****,10,인생 영화중 하나어떤순간에도 나를 포기하지 않기.
모가디슈,gkgk****,6,IMAX로 보면 더 재밌을 영화
랑종,zxc7****,2,이 영화를 보고나서 재밌다고 하는 사람들이 실제로 존재 한다는게 공포입니다. 평점 알바인줄 알았는데 같이 본 친구는 너무 재밌었다네요 ㅋㅋㅋㅋ
랑종,coco****,7,공포<기괴
방법: 재차의,laye****,1,한국영화와 이딴 영화를 보다간 관객이 좀비가 될 판.
모가디슈,jole****,10,개봉하자마자 조조로 봤다 ! 잘생긴 조인성 보면서. 완젼 우와~~봤다. 조인성과 김윤석의 조합이 너무 잘 맞았지만...  모가디슈는 솔직히 김윤석이 살렸다 영화 보는 내내. 그들 연기에 완젼 빨려 들어 갔다  꼭 3번 보세요
모가디슈,imsu****,10,끝까지 몰입감 최고! 강추합니다^^
모가디슈,wodu****,9,역시 믿고보는..김윤석 조인성  ..코로나라서 아쉽다..
모가디슈,laye****,1,아니나 다를까 또 북한 미화물. 액션영화에 기대를 건 정상인 관객들만 호구된다.
걸,ehfk****,8,"성별이 그 어떤 의미도 가지지 않고, 그저 혈액형처럼 의료서비스를 받을 때에만 분별되어지길. 몸이 아닌 개개인의 인격체로 온전히 존재하는 세상이 되길. 몸이 아니라 세상을 바꾸기 위해 모든 부모와 어른들이 고찰하고 변화해야 한다. 성별에 따라 이름을 짓고 옷의 형태와 색깔을 정하고 머리길이를 규정하고 심지어 성별에 의해 사회적 역할까지 정해지는 세상이라니. 어떻게 인간세상이 이다지도 비합리적이고 멍청한가."
모가디슈,kmx9****,8,뜨거운 요리일수록 컴팩트하게
모가디슈,ttet****,10,한여름 폭염을 잊기에 충분한 영화~ 역시 류승완 감독~
모가디슈,mans****,1,군함도에 버금가는 대작
모가디슈,jooj****,10,2시간이 아깝지 않은 영화. 보는 내내 점점 빠져들었다특히 배우들 연기가 압권
모가디슈,over****,10,영화관에서 꼭 봐야함. 스펙터클 영상미가 쩔었음. 1000만 갈 듯?!
모가디슈,qkdr****,10,지렸다.. 내가 소말리아에 있는줄
모가디슈,tipe****,8,차는 역시 벤츠
모가디슈,tipe****,8,차는 역시 벤츠
모가디슈,cmw1****,4,별로 감독님왓두유 원투 세이??아이 디든 캐치 애니팅
유령선,apos****,1,그런데 왜 정권바뀌고 4년이나 지나면서 게다가 세월호 특조위까지 대대적으로 꾸려왔음에도 아무진실도 못밝혀 낸거지? 그날 바다 제작자이자 교통방송 진행자 뚱돼지는 청와대 앞에서 단식 투쟁이라도 해야되는거 아님?
집으로...,wans****,10,어릴때보고 다시봤는데 할머니의 내리사랑은 헤아릴수없을정도로 크다는걸 다시한번 느꼈어요 저는 어렸을때부터 할머니가 안계셨지만 할머니의 사랑을 어렴풋이 알것같아요진짜 좋은영화입니다
모가디슈,chl1****,8,"개인적으로 가장 극찬하고 싶은 순서가  1.영상미 2.연출 3.연기 4.ost 5.스토리 순서입니다. 특히, 전부 액션씬을 돋보이게 해주는 역할을 해서 더 긴장감있게 몰입할 수 있었습니다. 하지만, 유일하게 아쉬웠던 점이 어느 정도 시청하는 중간에 예측할 수 있을 것 같은 전개랑 더 보여주면 좋을텐데 2시간이라는 상영시간에 맞춰 생략된 장면이 있는 것 같아서 아쉬웠습니다. 그 외에는 정말 훌륭한 영화였습니다. 감독판이나 미개봉편이 나오면 또 보고 싶네요ㅎㅎㅎㅎ"
블랙 위도우,smar****,2,음.과연 안본 상태인데..평점작성이 될것인가...
모가디슈,fire****,10,생각보다 너무 재밌었어요^^
분노의 질주: 홉스&쇼,rich****,5,바네사 커비만 귀엽다.사모아 춤의 뜬금없는 등장은 정말 유치해서 내가 먼저 죽는 줄 알았다. 총으로 싸워도 될 걸 억지로 그렇게 껴맞춰야했냐. 드웨인이 원탑으로 나오는 영화들은 하나같이 왜 다 이모양이냐?
립반윙클의 신부,noto****,8,이와이 슌지 작품들 다 좋아하는데 이건 다 못 보겠다
시간위의 집,miyu****,8,스토리 좋은데  연출이 아쉬워요.스릴러가 아닌 가족영화
랑종,onep****,10,재밌네요 스토리를 파악하기가 좀 어려웠어요 보실 분들은 사소한 요소를 놓치면 스토리를 초음부터 끝까지 이해 못 하실 수도 있어요.
퍼,soul****,10,
모가디슈,gksw****,10,이걸 1점준 관종들은 그냥 테러하는거지?
모가디슈,surs****,1,알바들 풀었나
모가디슈,swat****,10,아프리카 소말리아에있는듯한 자연스럽고 리얼한 분위기를 정말 연출잘했고 후반부 액션신 미쳤음 처음부터 끝까지 군더더기없이 잘만듬
클레멘타인,ckn9****,10,눈물있이 볼 수 없는 영화
방법: 재차의,jjaj****,8,k좀비는 운전도 한다 개멋있어
갈매기,lsb8****,10,주인공의 강단이 오늘의 나를 되돌아보게 만든다... 나는 나를 선택했다!
모가디슈,ksu1****,10,재밌게 봤습니다돈아깝진않음
모가디슈,imbc****,6,"독일차 쵝오, 수동차 만세"
모가디슈,gem7****,10,시간가는줄모르고봤어요조인성님의재미포인트 감정포인트 다 느낄수있어서좋았어요^^
모가디슈,thdu****,10,생각보다 평점이 낮네요정말 잘 봤습니다!
방법: 재차의,ru40****,10,재차의 나왔을때 너무 놀람. 옆자리 재연이 소리에 더 놀람
모가디슈,jjan****,8,8점 입니다 나쁘지 않아요 적어도 돈이 아깝진 않아요 몰입도도 좋고요
방법: 재차의,gns6****,10,기대 안하고 드라마도 안봤는데 쫄깃 ㅋㅋ
모가디슈,sama****,10,"연기, 스토리, 몰입도, 재미 다 있습니다."
모가디슈,ooya****,10,마지막 장면에서 실로 오랜만에 눈물이 흘렀다.
모가디슈,pann****,10,캐릭터부터 서사 마지막의 적당한 마무리까지 모든것이 완벽했다. 개인적으로는 마지막 카체이싱을 위해 아맥 추천
모가디슈,psk8****,10,코로나아니였으면 천만관객이였을만한 영화에요ㅠㅜ시간가는줄몰랐어요 몰입도최고 조인성최최고
모가디슈,dldh****,10,너무나도 재밌는영화네요
보스 베이비 2,song****,10,형제가 서로 다시 친해져서 좋은 것 같습니다.
해리 포터와 비밀의 방,chae****,10,해리포터는 계속 봐도 재밌음
캐빈 인 더 우즈,nikk****,10,이거 진짜 신박하네요~ 공포 라기 보다는 액션 호러 ㅎㅎ
갈매기,ara5****,10,현시대의 사회 문제를 다양하게 담아내어서 보기 좋았음. 이런 영화들을 많이 봐줘야 하는데 ㅠㅠ
타인의 삶,wym3****,10,최근 본 영화 중에 가장 좋았습니다.
모가디슈,jiki****,10,제가 생각한 모가디슈 내전 관련 스토리는 아니었지만 그 당시 대사관들 내용도 참신하고 재밌습니다북한과의 내용이라 마지막은 감동도 어느정도 있었구요
해리 포터와 혼혈 왕자,chae****,10,해리포터는 진짜 계속봐도 재밌음
모가디슈,siri****,10,와 이 영화 찐이다
"우리, 둘",ara5****,10,올해 본 영화들 중에서 가장 좋았다! 이게 데뷔작이라니..데뷔갓작
괴기맨숀,gmlc****,10,아니 무서우면무섭다고하면되지 별점1점주고 안무서운척오지네가오인가 어차피 영화들봤때 존나 놀랄떄놀라고 손가락으로 가리면서 봤을거면서겉멋잡기는...좀 솔직해집시다 님들아
모가디슈,rem4****,1,이제 한국 영화에서 북한 그만 나왔으면 좋겠다.
모가디슈,kane****,10,류승완의2번실패는없다. 올해최고의 영화라고봄
모가디슈,ddbi****,1,또또 김치퍽킹 신파 전라도 스러움이 물씬풍기는 그런 개노잼 영화네요
아이스 로드,augu****,6,한여름에 북미 설원을 실컷 보니 시원하긴 하다. 90년대 B급 액션물 나오듯이 온갖 곳에 나와서 사람들을 구하는 리암니슨 시리즈 중 하나일 뿐이지만. 그 중에서도 아쉬운 편.
모가디슈,nasf****,2,하 ㅡ 해운대 소말리아 버젼..군함도 2...하  왜그래요 류 감독 ㅠ대작말고
모가디슈,bmw2****,6,글세 아직 안봤지만 글케 젬있지는 안을듯 싶다 봐야 알겠지만 영화 광인 내가봐야 알지
모가디슈,2hun****,4,
이도공간,augu****,8,"장국영의 유작. 그의 매력이 얼마나 대단했는지를 다시금 확인할 수 있다. 영화의 짜임새는 아쉬움이 큰데, 배우들의 연기로 다 커버한다. 임가흔도 이때 매력 장난 없었네. 그립구만."
델마와 루이스,wse0****,10,통쾌한 여자들의 리벤지
모가디슈,yunj****,9,‘분단’이라는 소재를 가장 잘 사용하는 감독
정글 크루즈,pang****,10,아마존 익스프레스가 용인이 아니라 CGV에 있었네;;
미나리,yhb1****,10,재밌음
모가디슈,powe****,6,방금보고 후기남깁니다.  뭔가 2프로  아쉽습니다. 담백한 다큐정도?  전개 또한  끊어지는 느낌? 명품  배우 구성원치곤  연출이 아쉽웠네요.  조미료를  좀 더 가미시켰으면 하는...흥행작은 안될것 같네요ㅡ
고질라 VS. 콩,yhb1****,10,재밌음
비와 당신의 이야기,yhb1****,10,재밌음
분노의 질주: 더 얼티메이트,yhb1****,10,재밌음
올드 가드,tjqh****,10,그냥 지렸다. 2편 나올 때까지 숨 안 쉼.
방법: 재차의,kayl****,10,굿. 2편 내놓으쇼!!! 방법 팬 아니더라도 재밌을검
모가디슈,khc7****,2,계속 자고 나옴.  볼계획도 없었으나시간이 안맞아본 영화. 제발 신파 이념영화 좀 그만해라
발신제한,yhb1****,10,재밌음
블랙 위도우,plum****,8,"초능력자도 아닌게 왜 이렇게 까부나 싶었는데, 이유가 다 있더랍니다.그래서 보니까 재밌었답니다."
새콤달콤,phs7****,10,"내용도 커플들이 공감할만한 내용이였고, 배우들 연기력을 떠나서 스토리가 미쳤음.마지막 반전 때 그동안의 행동들 퍼즐 하나 하나 맞춰지는거 보고 와... 소리내면서 봤음."
꽃다발 같은 사랑을 했다,augu****,8,"일본영화 특유의 오글거리는 부분이 없진 않다. 완벽한 공통점을 가진 커플이 삶의 굴레 앞에 이리저리 뒤틀리며 겪게 되는 감정의 변화를 멋지게 그렸다. 비록 이루어지지 않더라도, 따뜻한 기억만으로도 사랑이 의미 있음을 보여준다.  오랜만에 보는 명품 멜로."
모가디슈,syw1****,10,잔잔해서 좋았고 액션도 좋았어요 극장가서 꼭 보세요….
방법: 재차의,ktpl****,10,
모가디슈,jemm****,10,출연자 모든분들이 연기를 너무 잘하셨어요!! 영화 추천입니다~^^
꽃다발 같은 사랑을 했다,woja****,10,왜 헤어지는 커플에게 추천했는지 알 것같아요 ㅠ 여운 계속 남습니다너무 현실적이라서 마음이 속상했던.. 영화 ㅠㅠ
모가디슈,kjhk****,10,마지막에 비행기에서 내릴 때 서로 아는척 못하는게 너무 슬프다
블랙 위도우,juye****,10,우리 나타샤 최고
도쿄 올림픽,indk****,1,쓸 말이 없다....ㅋ
인턴,ance****,8,드 니로의 평온하며 능청스러운 연기가 포인트
모가디슈,plz9****,8,극장에 관객수 저포함 셋...  더운데 찍으시느라고생하셧고 나쁘지않게 관람잘했습니다. 밤촬영이 너무어둡긴햇는데..  것두 나쁘진않았구요 . 야외촬영할때 카메라가 너무흔들려서ㅠ 어지러웠습니다. 10점은 못드리지만 극장에서 볼만한 영화인거같습니다.
죠스,yaso****,10,"물 흐르듯 자연스러운 이야기 전개와 진짜배기 배우들의 호연, 그리고 70년대 영화들 특유의 빼어난 영화음악까지 뭐 하나 빠지지 않는 여름 스릴러의 교과서같은 영화. 요즘 애들은 40년전 영화가 놀랍느니 어쩌구 하는데 70-90년대 영화들이 CG 떡칠 + 발연기 배우들 + 일천한 철학과 허접한 미장센만 배운 감독들이 만든 작금의 영화들보다 재미도 철학도 더 깊다."
크루엘라,daal****,6,10점은 알바라고 봅니다. 이영화만큼은 평론가 점수가 맞을듯...
모가디슈,jjy3****,10,스토리도 탄탄하고 배우들의 연기도 너무 좋았습니다! 오랜만에 극장에서 본 영화인데 강추합니다
모가디슈,whit****,10,몰입도 좋고재밌었음완전 추천
랑종,clea****,4,다큐멘터리 느낌을 살릴려고 일부로 계속 카메라를 흔든것 같은데 보다가 멀미나서 죽는줄 알았어요…ㅠㅠㅠㅠ 마지막은 무슨 좀비영환줄 뒤에는 무섭지도 않고 어이가없어서 웃으면서 봤습니다 근데 밍 역활하신 배우님 연기 너무 잘하셔서 영화가 아니라 실제다큐 촬영한줄….
블랙 위도우,sdj0****,10,블랙위도우는 언제나 다른 사람을 먼저 생각하는 따뜻한 영웅이라는 걸 보여준 영화
모가디슈,shin****,10,기대안하고 봤는데 너무 재밌었음. 구교환 배우의재발견
모가디슈,pygi****,10,재밌어요 추천합니다^
모가디슈,ldk6****,10,젛아좋아조항좋아아좋아아아
분노의 질주: 더 세븐,asdf****,10,몰입감 최고 ㅠㅠ 마지막에 눈물..
방법: 재차의,jky9****,10,
방법: 재차의,shin****,9,재차의가 좀비보다 강력하네요+ㅅ+ 흥미로운 소재로 화끈한 액션까지 볼거리가 많아서 극장에서 보는 거 추천! 우리 모두 마스크 끼고 안전 관람해요!!!
모가디슈,gems****,1,북한 미화하는 좌파영화 좀 그만 만들면 안되는지??만져당 집권하며 문화로 포장한 좌빨 사상교육 넘 심하다
블랙 위도우,dbcm****,10,재밌어요~~ 사실 그렇게 기대 안했는대 잘봤습니다.
모가디슈,tlqk****,10,ㄹㅇ아르고 액션버전ㅋㅋㅋㅋ조인성 연기 너무 잘해...
모가디슈,limc****,10,"재밌습니다, 추천드립니다."
블랙 위도우,rich****,5,꼴페미가 점령한 디즈니가 망해가는 시점에 나온 작품 중 하나.레나던가. 스칼렛 여동생으로 나온 여배우 귀엽긴 하다.근데 블랙위도우 하기에 너무 짧고(스칼렛도 짧지만) 토실토실해서 둔해보인다.스토리는 그냥저냥에 기억에 남는 특별한 장면은 없다.그나마 제일 재미있었던 건 상점 안에서 레나가 스칼렛에게 싸우기 전에 이거 왜 하냐고 물어보는 장면이 귀여웠다. ㅎ 그거 나도 궁금했거든.마블에 대한 애정이 조금 있어서 그나마 5점 준다.
보스 베이비 2,shin****,1,정신없고 산만하기만한..
랑종,limi****,2,"나홍진이 직접 감독으로 한국영화로 만들었어야됐다. 스토리니 연출이니 다 떠나서 ""빡빡빡빡"" 이렇게 들리는 태국어에 태국배우들때문에 진짜 몰입안되고 짜증만났다"
모가디슈,iwan****,10,카체이싱 장면만으로도 볼 가치가 충분... 류감독님 연출 너무좋고 배우분들도 정말 딱 맞는 옷을 입은 느낌입니다
꽃다발 같은 사랑을 했다,wlsa****,9,"일본 감성, 현실적인 연애, 잔잔한 스토리, 아쉬운 전개, 아쉬운 결말하지만 영화를 보고 난 후 계속 생각나는 영화 다시 한번 보고 싶다.일본의 이 특유 감성은 정말 어떤 영화를 봐도 느낄 수 없다."
블랙 위도우,35so****,10,연기와 연출이 대박이에요
파수꾼,tokk****,10,각자 배우들 연기의 아픔이 함께 느껴진다..
모가디슈,toda****,1,
모가디슈,tops****,7,부모님이 즐거워 하셨으니 만족.
모가디슈,kaen****,10,너무 재미있네요 완성도 높은 영화 개봉해주셔서 감사합니다
가타카,s6d9****,10,너무나도 슬픈영화다...
아수라,supe****,8,망한 영화라길래 봤는데 재미있는데 ㅋㅋㅋ
에놀라 홈즈,chan****,10,밀리 너무 귀엽고 개연성도 좋음!!
케빈에 대하여,moon****,8,제작의도와는 다르게 결국 부모나 엄마에게 원인을 돌리는 풍조는 사라지지 않는 것 같습니다. 임신이 기쁘지 않았다 하여 그런 반사화적인 패륜범죄를 저지르는 아이가 탄생하진 않습니다. 아무래도 임신중 이후 출산 이후 육아태도나 환경은 인격형성에 영향을 준다에 동의하지만 태초 아이의 기질적인 부분이 애당초 예민하고 까칠하게 잉태된 것은 틀림없는 듯 보여집니다. 그 기질이 약하면 환경에 의해 중화되기도 하지만 영화상 보면 부모의 행동에 특이점을 찾지 못했습니다. 임신과 출산이 반드시 행복이라는 허상을 벗어야 한다고 생각합니다. 실은 고단하고 힘든 부분이 있다는 사실과 마음의 준비 등이 오히려 중요하다고 생각합니다. 태어난 아이들 형제자매를 보면 한부모라도 타고난 기질이 각양각색입니다. 언제까지 부모탓으로 할 것인지.유치원쯤만 되도 자신의 주체적인 생각을 하는데 왜 그런 못된 짓이 엄마의 양육탓이라 하는지 도무지 이해가 안갑니다. 잘못된 부모가 있었다면 생각을 하는 자신은 스스로 다른 선택을 해야하는 것이 맞다.
모가디슈,hjh6****,10,오랜만에 재밌는 영화 극장에서 봤네요
방법: 재차의,kwns****,10,"완전 내스타일! 긴장감, 사운드, 연기 싹 다 잡았네. 드라마 시즌2까지 기대되요.크레딧 끝나고 쿠키영상은 나혼자 보더라 쿠키영상 2개에요. 꼭 보세요 앞으로 나올 드라마랑 연관있을듯"
아이리시맨,jazz****,10,3시간반 절대 길지 않습니다.시계한번 안보고 쭉 봤어요.“굿풸라즈”와 같이 ost 상당합니다.러닝타임 겁나서 안보고 있었는데진작 볼걸 했네요!시간나면 딴거하지말고 이거 일단 보세요!!
정글 크루즈,o2so****,3,이게 뭐하자는 거여 기대가 컸던만큼 실망도 컸습니다 너무 뻔해요
모가디슈,sun4****,1,좌파 북한 찬양영화....
방법: 재차의,lenf****,10,시간이 남아서 영화관에 왔다가 마침 오늘개봉하는 영화가 있길래 골라봤는데 재미있게 봤어요! 특히 기생충에 나왔던 여자아이가 나와서 반가웠는데 많이 커서 그런지 더 이뻐졌구 표정연기가 진짜 엄청나더라구요 분량이 좀 아쉬웠지만 나오는 부분에서의 비중은 알차긴 했던거같아요 스토리도 가볍게 볼만해서 좋았던것같습니다
모가디슈,ju02****,8,
모가디슈,shar****,4,진짜 이거에 별점5점을 주다니요....군함도보다 더 심하네요
완벽한 타인,hong****,9,재밌게 봤습니당 다들 연기 잘하세요
랑종,juns****,10,이 영화는 다른 이들의 의견은 크게  중요하지 않다. 직접 관람 후 판단 하시길.
보스 베이비 2,gi32****,2,자막 퀄리티가 떨어집니다
미드소마,inoa****,10,고어를 예술로 승화시킨 영화. 보는 내내 몽환적인 분위기가 아름다웠습니다.
모가디슈,smar****,6,빨갱이 빨갱이 빨갱이 빨갱이 영화
미드나이트,wkdd****,9,배우들 연기를 너무 잘해서 몰입이 잘됨 답답해서 별로라는 사람들 많은데 안답답하고 범인이 바로 잡히면 그게 어케 영화가 됨? 어느정도 꼬아야 재밌어지는거임 난 나름 재밌고 스릴러답게 쫄면서 봄 또 장애를 가지신 분들이 살면서 얼마나 불편한 점들이 많은지 깨닫게 해주는 영화.. 모두 힘내시길..
괴기맨숀,ch2m****,10,자기야 나 여기다가 댓글 쓰는거 아무한테도 이야기하면 안돼.
모가디슈,imci****,9,단 한가지 아쉬운건 문화날에 할인을 못받고 본것이다
뷰티풀 보이스,clea****,10,한공간에서 이루어지는 오합지졸들의 하모니
발신제한,hsun****,5,그냥 그렇다매우 뻔한 스토리여자친구는 재밌다고 해서 5점
블랙 위도우,momo****,10,누가 뭐래도 마블은 역시 짱
보스 베이비 2,orsi****,10,여전히 귀요미네용~^^
"나는 내일, 어제의 너와 만난다",dlsq****,10,우리나라 개 억지 신파극으로 울리려고 개 발광을 떨지 않아도 울수있다는걸 보여주는 영화
모가디슈,qlrq****,10,역시 김윤석역시 조인성
방법: 재차의,oway****,10,드라마 보고 영화도 봤는데 너무 자극적이지도 않고 즐기기에 좋은 영화였습니다. 깜짝깜짝 놀라는 장면도 있었고 스토리도 좋았네요. 전 드라마도 괜찮지만 영화쪽에 좀 더 점수를 주고 싶네요. 재밌게 잘 봤습니다. 다음 시리즈도 기대됩니다.
정글 크루즈,ddun****,10,이번 여름 휴가는 극장으로 4DX완전 개대 됨!!
모가디슈,wpgu****,10,
셔터,dldy****,10,ㅇ건 진짜 보고 리뷰남겨라.. ㅋㅋㅋㅋ
